{
  "$schema": "https://json-schema.org/draft/2020-12/schema",
  "$id": "https://skenion.dev/schemas/runtime/v0/project-request.schema.json",
  "title": "skenion Runtime Project Request v0.1",
  "description": "Runtime project load/validate/plan/run request envelope. It carries the ProjectDocumentV01 top-level fields plus the node definitions required by the Runtime node registry for this request.",
  "type": "object",
  "required": [
    "schema",
    "schemaVersion",
    "id",
    "revision",
    "graph",
    "viewState",
    "patchLibrary",
    "nodes"
  ],
  "properties": {
    "schema": {
      "$ref": "https://skenion.dev/schemas/project/v0.1/project.schema.json#/properties/schema"
    },
    "schemaVersion": {
      "$ref": "https://skenion.dev/schemas/project/v0.1/project.schema.json#/properties/schemaVersion"
    },
    "id": {
      "$ref": "https://skenion.dev/schemas/project/v0.1/project.schema.json#/properties/id"
    },
    "revision": {
      "$ref": "https://skenion.dev/schemas/project/v0.1/project.schema.json#/properties/revision"
    },
    "metadata": {
      "$ref": "https://skenion.dev/schemas/project/v0.1/project.schema.json#/properties/metadata"
    },
    "graph": {
      "$ref": "https://skenion.dev/schemas/project/v0.1/project.schema.json#/properties/graph"
    },
    "viewState": {
      "$ref": "https://skenion.dev/schemas/project/v0.1/project.schema.json#/properties/viewState"
    },
    "patchLibrary": {
      "$ref": "https://skenion.dev/schemas/project/v0.1/project.schema.json#/properties/patchLibrary"
    },
    "packageDependencies": {
      "$ref": "https://skenion.dev/schemas/project/v0.1/project.schema.json#/properties/packageDependencies"
    },
    "packageLock": {
      "$ref": "https://skenion.dev/schemas/project/v0.1/project.schema.json#/properties/packageLock"
    },
    "resourceLock": {
      "$ref": "https://skenion.dev/schemas/project/v0.1/project.schema.json#/properties/resourceLock"
    },
    "objectBindings": {
      "$ref": "https://skenion.dev/schemas/project/v0.1/project.schema.json#/properties/objectBindings"
    },
    "tutorial": {
      "$ref": "https://skenion.dev/schemas/project/v0.1/project.schema.json#/properties/tutorial"
    },
    "help": {
      "$ref": "https://skenion.dev/schemas/project/v0.1/project.schema.json#/properties/help"
    },
    "nodes": {
      "type": "array",
      "minItems": 1,
      "items": {
        "$ref": "https://skenion.dev/schemas/node/v0.1/node-definition.schema.json"
      }
    }
  },
  "additionalProperties": false
}
