{
  "schema": "skenion.project",
  "schemaVersion": "0.1.0",
  "id": "runtime-project-with-nodes",
  "revision": "1",
  "graph": {
    "schema": "skenion.graph",
    "schemaVersion": "0.1.0",
    "id": "runtime-project-root",
    "revision": "1",
    "nodes": [
      {
        "id": "float_1",
        "kind": "core.float",
        "kindVersion": "0.1.0",
        "params": {
          "value": 0.5
        },
        "ports": [
          {
            "id": "value",
            "direction": "output",
            "type": "control.number.float"
          }
        ]
      }
    ],
    "edges": []
  },
  "viewState": {
    "schema": "skenion.view-state",
    "schemaVersion": "0.1.0",
    "canvas": {
      "nodes": {
        "float_1": {
          "x": 40,
          "y": 32
        }
      }
    }
  },
  "patchLibrary": [],
  "nodes": [
    {
      "schema": "skenion.node.definition",
      "schemaVersion": "0.1.0",
      "id": "core.float",
      "version": "0.1.0",
      "displayName": "Float",
      "category": "Typed Controls",
      "ports": [
        {
          "id": "in",
          "direction": "input",
          "label": "In",
          "type": "control.message.any",
          "required": false,
          "messageSelectors": {
            "accepted": [
              "bang",
              "set",
              "float",
              "int",
              "uint",
              "bool"
            ],
            "silent": [
              "set"
            ],
            "trigger": [
              "bang",
              "float",
              "int",
              "uint",
              "bool"
            ],
            "store": [
              "set",
              "float",
              "int",
              "uint",
              "bool"
            ],
            "emit": [
              "bang",
              "float",
              "int",
              "uint",
              "bool"
            ]
          }
        },
        {
          "id": "cold",
          "direction": "input",
          "label": "Cold",
          "type": "control.number.float",
          "required": false
        },
        {
          "id": "value",
          "direction": "output",
          "label": "Value",
          "type": "control.number.float"
        }
      ],
      "execution": {
        "model": "control"
      },
      "state": {
        "persistent": false
      },
      "permissions": [],
      "capabilities": [],
      "surface": {
        "palette": "direct"
      }
    }
  ]
}
